{
  "$schema": "../../schemas/connector.schema.json",
  "id": "openrouter",
  "name": "OpenRouter",
  "category": "ai",
  "kind": "ai-openai-compatible",
  "description": {
    "es": "Una sola API para cientos de modelos de distintos proveedores.",
    "en": "One API for hundreds of models from many providers."
  },
  "website": "https://openrouter.ai",
  "docs": "https://openrouter.ai/docs",
  "color": "#6467F2",
  "tags": [
    "llm",
    "router",
    "aggregator"
  ],
  "baseUrl": "https://openrouter.ai/api/v1",
  "auth": {
    "type": "bearer",
    "field": "apiKey"
  },
  "fields": [
    {
      "key": "apiKey",
      "label": {
        "es": "Clave de API",
        "en": "API key"
      },
      "type": "secret",
      "required": true
    }
  ],
  "models": {
    "listable": true,
    "suggested": [
      "openai/gpt-6-astra",
      "google/gemini-3.8-flash",
      "x-ai/grok-4.6"
    ]
  }
}
